{
  "schemaVersion": "1.0",
  "taskId": 88,
  "runIds": {
    "dataQuality": 201,
    "marketRegime": 202,
    "technicalAnalysis": 203,
    "strategyBacktest": 204,
    "announcementRisk": 205,
    "positionRisk": 206
  },
  "symbol": "600000",
  "tradeDate": "2026-07-14",
  "contextHash": "bbbbbbbbbbbbbbbbbbbbbbbbbbbbbbbbbbbbbbbbbbbbbbbbbbbbbbbbbbbbbbbb",
  "contextSchemaVersion": "1.0",
  "ruleVersion": "1.4.0-stage-2b-dq-v1",
  "executionMode": "LOCAL_RULES",
  "contextSnapshot": {
    "security": {
      "available": true,
      "queriedAt": "2026-07-14T05:00:00Z",
      "queryScope": {
        "symbol": "600000",
        "tradeDate": "2026-07-14"
      },
      "symbol": "600000",
      "name": "测试证券",
      "board": "MAIN",
      "industry": "银行",
      "listDate": "1999-11-10",
      "isSt": false,
      "isActive": true,
      "dataSource": "LOCAL",
      "qualityFacts": {
        "placeholderSuspected": false,
        "sourceKnown": true,
        "pointInTimeGuaranteed": true
      }
    },
    "marketData": {
      "available": true,
      "queriedAt": "2026-07-14T05:00:00Z",
      "queryScope": {
        "symbol": "600000",
        "tradeDate": "2026-07-14"
      },
      "adjustType": "QFQ",
      "requestedTradeDate": "2026-07-14",
      "effectiveTradeDate": "2026-07-14",
      "exactTradeDateMatch": true,
      "actualBars": 61,
      "bars": []
    },
    "marketBreadth": {
      "available": false,
      "reason": "阶段2B未接入",
      "queriedAt": "2026-07-14T05:00:00Z",
      "queryScope": {
        "symbol": "600000",
        "tradeDate": "2026-07-14"
      }
    },
    "scanResult": {
      "available": false,
      "reason": "阶段2B未接入",
      "queriedAt": "2026-07-14T05:00:00Z",
      "queryScope": {
        "symbol": "600000",
        "tradeDate": "2026-07-14"
      }
    },
    "technicalMetrics": {
      "available": true,
      "queriedAt": "2026-07-14T05:00:00Z",
      "queryScope": {
        "symbol": "600000",
        "tradeDate": "2026-07-14"
      },
      "formulaVersion": "JAVA_INDICATORS_V1",
      "adjustType": "QFQ",
      "requestedTradeDate": "2026-07-14",
      "effectiveTradeDate": "2026-07-14",
      "requiredBars": 61,
      "actualBars": 61,
      "values": {}
    },
    "backtestContext": {
      "available": false,
      "reason": "阶段2B未接入",
      "queriedAt": "2026-07-14T05:00:00Z",
      "queryScope": {
        "symbol": "600000",
        "tradeDate": "2026-07-14"
      }
    },
    "securityEvents": {
      "available": false,
      "reason": "阶段2B未接入",
      "queriedAt": "2026-07-14T05:00:00Z",
      "queryScope": {
        "symbol": "600000",
        "tradeDate": "2026-07-14"
      }
    },
    "portfolioContext": {
      "available": false,
      "reason": "阶段2B未接入",
      "queriedAt": "2026-07-14T05:00:00Z",
      "queryScope": {
        "symbol": "600000",
        "tradeDate": "2026-07-14"
      }
    },
    "dataQualityContext": {
      "available": true,
      "queriedAt": "2026-07-14T05:00:00Z",
      "queryScope": {
        "symbol": "600000",
        "tradeDate": "2026-07-14"
      },
      "facts": {
        "securityRecordPresent": true,
        "securityPlaceholderSuspected": false,
        "securitySourceKnown": true,
        "securityPointInTimeGuaranteed": true,
        "loadedBarCount": 61,
        "requiredBarsForTechnicalMetrics": 61,
        "exactTradeDatePresent": true,
        "requestedTradeDate": "2026-07-14",
        "effectiveTradeDate": "2026-07-14",
        "naturalDayLag": 0,
        "tradingCalendarAvailable": true,
        "missingAmountCount": 0,
        "missingTurnoverRateCount": 0,
        "invalidBarCount": 0,
        "invalidBarDates": [],
        "maximumObservedNaturalDayGap": 1,
        "duplicateProtection": "PRIMARY_KEY_SYMBOL_TRADE_DATE_ADJUST_TYPE",
        "sourceConsistencyAssessable": true,
        "adjustTypesObserved": [
          "QFQ"
        ],
        "missingSecurityFields": []
      }
    }
  },
  "requestedAt": "2026-07-14T05:01:00Z"
}
