{
  "schemaVersion": "1.0",
  "taskId": 89,
  "runIds": {
    "dataQuality": 211,
    "marketRegime": 212,
    "technicalAnalysis": 213,
    "strategyBacktest": 214,
    "announcementRisk": 215,
    "positionRisk": 216
  },
  "symbol": "600000",
  "tradeDate": "2026-07-14",
  "contextHash": "e81bb7f0956ebd3eb533aaf111ea5546f6e79c5f974aabe3842b8371b22f164f",
  "contextSchemaVersion": "1.0",
  "ruleVersion": "1.4.0-stage-2b-dq-v1",
  "executionMode": "LOCAL_RULES",
  "contextSnapshot": {
    "security": {
      "available": true,
      "queriedAt": "2026-07-14T05:00:00Z",
      "queryScope": {"symbol": "600000", "tradeDate": "2026-07-14"},
      "symbol": "600000",
      "name": "测试证券",
      "board": "MAIN",
      "industry": "银行",
      "listDate": "1999-11-10",
      "isSt": false,
      "isActive": true,
      "dataSource": "LOCAL",
      "qualityFacts": {
        "placeholderSuspected": false,
        "sourceKnown": true,
        "pointInTimeGuaranteed": true
      }
    },
    "marketData": {
      "available": true,
      "queriedAt": "2026-07-14T05:00:00Z",
      "queryScope": {"symbol": "600000", "tradeDate": "2026-07-14"},
      "adjustType": "QFQ",
      "requestedTradeDate": "2026-07-14",
      "effectiveTradeDate": "2026-07-14",
      "exactTradeDateMatch": true,
      "actualBars": 61,
      "bars": []
    },
    "marketBreadth": {
      "available": true,
      "queriedAt": "2026-07-14T05:00:00Z",
      "queryScope": {"symbol": "600000", "tradeDate": "2026-07-14"},
      "reasonCode": null,
      "reason": null,
      "sourceType": "DATABASE",
      "sourceTables": ["daily_bars", "securities"],
      "sourceStatus": "AVAILABLE",
      "producer": "AgentMarketBreadthContextService",
      "producerVersion": "MARKET_BREADTH_V1",
      "versionAvailable": true,
      "requestedTradeDate": "2026-07-14",
      "effectiveTradeDate": "2026-07-14",
      "previousEffectiveTradeDate": "2026-07-13",
      "exactTradeDateMatch": true,
      "pointInTimeGuaranteed": false,
      "barFutureDataExcluded": true,
      "universePointInTimeGuaranteed": false,
      "futureDataExcluded": false,
      "timestampTimezoneSemantics": "TRADE_DATES_ARE_LOCAL_DATE_QUERIED_AT_IS_UTC_INSTANT",
      "adjustType": "QFQ",
      "selectionRule": "CURRENT_MAIN_ACTIVE_NON_ST_UNIVERSE_UNIFIED_EFFECTIVE_DATE",
      "universeCount": 5,
      "coveredSymbolCount": 4,
      "comparableSymbolCount": 3,
      "advancingCount": 1,
      "decliningCount": 1,
      "unchangedCount": 1,
      "missingCurrentBarCount": 1,
      "missingPreviousBarCount": 1,
      "coverageRatio": 0.60000000,
      "limitations": ["CURRENT_SECURITIES_ATTRIBUTES_ARE_NOT_HISTORICALLY_VERSIONED"]
    },
    "scanResult": {
      "available": true,
      "queriedAt": "2026-07-14T05:00:00Z",
      "queryScope": {"symbol": "600000", "tradeDate": "2026-07-14"},
      "reasonCode": null,
      "reason": null,
      "sourceType": "DATABASE",
      "sourceTables": ["market_scan_failures", "market_scan_results", "market_scan_tasks"],
      "sourceTaskId": 701,
      "sourceRecordId": 801,
      "sourceRecordType": "SCAN_RESULT",
      "sourceStatus": "COMPLETED",
      "sourceCreatedAt": "2026-07-14T08:00:00",
      "sourceFinishedAt": "2026-07-14T09:00:00",
      "producer": "MarketDataCenterService",
      "producerVersion": null,
      "versionAvailable": false,
      "requestedTradeDate": "2026-07-14",
      "effectiveTradeDate": "2026-07-14",
      "sourceTaskTradeDate": "2026-07-14",
      "sourceResultTradeDate": "2026-07-14",
      "exactTradeDateMatch": true,
      "pointInTimeGuaranteed": false,
      "readSelectionFutureExcluded": true,
      "producerInputCutoffGuaranteed": false,
      "futureDataExcluded": false,
      "timestampTimezoneSemantics": "DATABASE_LOCAL_TIMESTAMP_WITHOUT_TIME_ZONE",
      "selectionRule": "LATEST_COMPLETED_OFFICIAL_FULL_BEFORE_REQUEST_DATE_END",
      "scanType": "FULL",
      "official": true,
      "symbolParticipationKnown": true,
      "symbolResultAvailable": true,
      "symbolScanFailed": false,
      "symbolSelected": true,
      "rank": 2,
      "sourceScanScore": 58.50,
      "filterReasons": ["A", "B"],
      "latestClose": 11.00,
      "dataSource": "LOCAL",
      "metrics": {
        "avgAmount20": 10000.00,
        "return5Pct": 1.2000,
        "return20Pct": null,
        "rsi14": null,
        "atr14Pct": null,
        "volumeRatio20": null,
        "breakout20": false
      },
      "failureFact": null,
      "limitations": [
        "PRODUCER_INPUT_CUTOFF_NOT_PERSISTED",
        "PRODUCER_VERSION_NOT_PERSISTED",
        "RAW_METRICS_JSON_NOT_COPIED"
      ]
    },
    "technicalMetrics": {
      "available": true,
      "queriedAt": "2026-07-14T05:00:00Z",
      "queryScope": {"symbol": "600000", "tradeDate": "2026-07-14"},
      "formulaVersion": "JAVA_INDICATORS_V1",
      "adjustType": "QFQ",
      "requestedTradeDate": "2026-07-14",
      "effectiveTradeDate": "2026-07-14",
      "requiredBars": 61,
      "actualBars": 61,
      "values": {}
    },
    "backtestContext": {
      "available": false,
      "queriedAt": "2026-07-14T05:00:00Z",
      "queryScope": {"symbol": "600000", "tradeDate": "2026-07-14"},
      "reasonCode": "BACKTEST_INPUT_CUTOFF_UNVERIFIABLE",
      "reason": "Existing backtest records do not persist a verifiable input data cutoff.",
      "sourceType": "DATABASE",
      "sourceTables": ["backtest_runs", "scan_backtest_results", "scan_backtest_tasks"],
      "sourceStatus": "UNAVAILABLE",
      "producer": null,
      "producerVersion": null,
      "versionAvailable": false,
      "requestedTradeDate": "2026-07-14",
      "effectiveTradeDate": null,
      "exactTradeDateMatch": false,
      "pointInTimeGuaranteed": false,
      "readSelectionFutureExcluded": false,
      "producerInputCutoffGuaranteed": false,
      "futureDataExcluded": false,
      "timestampTimezoneSemantics": "LEGACY_DATABASE_LOCAL_TIMESTAMP_WITHOUT_TIME_ZONE",
      "limitations": [
        "INPUT_END_DATE_NOT_PERSISTED",
        "INPUT_START_DATE_NOT_PERSISTED",
        "SCAN_BACKTEST_READ_HAS_NO_DATE_CUTOFF",
        "STRATEGY_VERSION_NOT_PERSISTED"
      ]
    },
    "securityEvents": {
      "available": false,
      "reason": "阶段2C未接入",
      "queriedAt": "2026-07-14T05:00:00Z",
      "queryScope": {"symbol": "600000", "tradeDate": "2026-07-14"}
    },
    "portfolioContext": {
      "available": false,
      "reason": "阶段2C未接入",
      "queriedAt": "2026-07-14T05:00:00Z",
      "queryScope": {"symbol": "600000", "tradeDate": "2026-07-14"}
    },
    "dataQualityContext": {
      "available": true,
      "queriedAt": "2026-07-14T05:00:00Z",
      "queryScope": {"symbol": "600000", "tradeDate": "2026-07-14"},
      "facts": {
        "securityRecordPresent": true,
        "securityPlaceholderSuspected": false,
        "securitySourceKnown": true,
        "securityPointInTimeGuaranteed": true,
        "loadedBarCount": 61,
        "requiredBarsForTechnicalMetrics": 61,
        "exactTradeDatePresent": true,
        "requestedTradeDate": "2026-07-14",
        "effectiveTradeDate": "2026-07-14",
        "naturalDayLag": 0,
        "tradingCalendarAvailable": true,
        "missingAmountCount": 0,
        "missingTurnoverRateCount": 0,
        "invalidBarCount": 0,
        "invalidBarDates": [],
        "maximumObservedNaturalDayGap": 1,
        "duplicateProtection": "PRIMARY_KEY_SYMBOL_TRADE_DATE_ADJUST_TYPE",
        "sourceConsistencyAssessable": true,
        "adjustTypesObserved": ["QFQ"],
        "missingSecurityFields": []
      }
    }
  },
  "requestedAt": "2026-07-14T05:01:00Z"
}
